{"format":"aui.snapshot-index","graphRevision":0,"indexFormat":"0.1-draft","lockDigest":"c80c7c6fc46e562563e530c2881e1cf603cdd1b96f93e19087b9af309b6b4769","operationId":null,"packageObjects":[{"contentDigest":"c866ac50e9c8bda04caff8cc83480c663645fa0a521d2e50a05dcb1e82a7f510","packageId":"example.locked"}],"projectId":"example.locked-pure","projectManifestDigest":"bdfff22a858d2cca619356bbfca2fe47e1db7bf443cb2153323e5a530ebf0a20","retiredIdentityDigest":"4f53cda18c2baa0c0354bb5f9a3ecbe5ed12ab4d8e11ba873c2f11161202b945","semanticGraphDigest":"34a7480186b2b1eec8e7bb9453ef2d8e2883538cd17d288ec1e573271eaba965","sourceFiles":[],"viewFiles":[{"ownership":"view","path":"views/main.auiview.json","sha256":"0de691479ed42c6d31be57cfe9e02d54eaf773476252d17b2892e20a0870af36"}]}